item_1_short,Labelling,ai_summary,scores,cosine_score
"ITEM 1. BUSINESS ﻿ INTRODUCTION ﻿ Evolving Systems provides real-time digital engagement solutions and services to approximately 100 customers in over 60 countries worldwide. Our portfolio features market-leading solutions and services for real-time analytics, customer acquisition and activation, customer value management and loyalty for the telecom industry promoting partnerships into retail and financial services. ﻿ We have transitioned from traditional software technology licensing, focused on cost savings, to selling business solutions focused on revenue growth and efficiency gains for the carrier. Our business model provides business solutions through customized software and managed services, thus creating recurring revenue relationships and providing opportunity to continually engage with our clients. ﻿ We offer real-time, interactive digital engagement solutions and services that drive increases in customer lifetime value for our enterprise clients as follows: ﻿ · Acquisition and Activation Solutions that increase new subscriber enrollments through multiple channels and dealer networks, electronically authenticate customer identity and activate complex bundles of traditional telecom services (voice, messaging and data) and value-added network services; · Network Services that improve operational efficiency by not only providing complete control of subscriber identification modules (“SIMs”) and their associated resources, but also streamlining and automating the entire SIM ordering and distribution process; · Retention and Loyalty Solutions that extend the duration of customer contracts by engaging them with the brand, interacting and rewarding them with personalized offers through loyalty and partner programs; and · Analytics and Customer Value Management Solutions that analyze consumer behavior in real-time and enable marketing departments to innovate, create and manage highly-personalized and contextually-relevant interactive campaigns that engage consumers with event-triggered offers that result in higher take-rates and increased customer revenue. ﻿ The combination of these offerings increases customer activations and activity, extends their lifecycle and increases customer spend resulting in increased customer lifetime value. ﻿ COMPANY BACKGROUND ﻿ Evolving Systems was founded in 1985 to provide software and services to the U.S. telecommunications industry. During our early years we focused on providing solutions that supported number management and number porting. In November 2004, we expanded our product set and geographical reach with the acquisition of Tertio Telecoms Ltd. (“Evolving Systems U.K.”), a supplier of Operations Support Systems (“OSS”) software solutions for service activation and mediation to communication carriers throughout Europe, the Middle East, Africa and Asia. With this acquisition we not only expanded our markets beyond North America, we also added service activation and mediation solutions to our product portfolio. The acquisition significantly expanded our product and service capabilities, allowing us to address a larger portion of our customers’ OSS application needs with a balanced mix of products as well as services. We focused primarily on the wireless markets in the areas of subscriber activation, SIM card management and activation, self-service mobile applications, data enablement solutions, connected device activation and management of services. Through continued investment in developing the next generation of these products, we maintain our status in these markets and strengthen our client relationships. ﻿ Acquisitions of BLS Limited (“EVOL BLS”), four Lumata Holdings subsidiaries, Lumata France SAS, Lumata Spain S.L., Lumata UK Ltd and Lumata Deutschland GmbH (collectively, “Lumata Entities”) in 2017, along with the acquisition of RateIntegration d/b/a Sixth Sense Media (“SSM”) in 2015, expanded our footprint in the digital marketing space. Each of these acquisitions had their own platform which we still maintain today. Through the extensive work of our product development team, we have launched the Evolution platform featuring the best of these legacy platforms on cutting edge technology. Evolution is used to operate the most innovative large-scale loyalty programs, as well as providing unique mechanics enabling gamification, optimization and personalization across a variety of channels. It enables our clients to engage with their customers at all stage of their lifecycle, providing interactive dialogue and smart recommendations through all available traditional and digital channels. The platform seamlessly integrates within the service provider’s IT infrastructure, either on-premise or on a private cloud. It can be operated or managed as a service depending on the market needs. As a supplier of real-time digital engagement solutions and services, we drive growth in customer acquisition and activation, extend customer lifetime and increase customer value and revenue in the converging mobile, entertainment, financial and retail services eco-system. Our platforms, together with our team of experienced industry experts, help service providers increase their customer lifetime value (“CLV”) over the course the customer lifecycle. ﻿ Evolving Systems provides software solutions and services throughout the world. The COVID-19 global outbreak has caused instability and volatility in multiple markets where our clients conduct business. We have leveraged our ability to provide support remotely resulting in limited effect on our day-to-day operations. The inability to travel has delayed interactions with our clients on projects and in the traditional modes of sales development. We continually work with existing and new clients exploring new ways of using our products and services to enhance their business. On-going travel restrictions has caused the business to interact with clients in new ways and reduced certain costs. The long-term effects on how we conduct business in the future is still undetermined but we continue to evolve to meet client needs. ﻿ INDUSTRY DYNAMICS ﻿ The market for digital engagement to increase customer lifetime value is growing. Several key factors are driving carrier demand for next generation solutions, supporting growth for specific products within the sector: ﻿ · Growing adoption of the digital channel and changing consumer sentiment, accelerated by the Covid-19 pandemic, has led to growing demand for digital services enabled by telecommunication carriers, not only for end consumers, but also brands, who want to reach specific consumer audiences; · Carriers are seeking to further monetize their customer relationships and associated demographic, behavioral, location and contextual information to up-sell their network services and open new channels for optimized and personalized third-party service revenues; · Rapid adoption of smart phones and network-attached devices has resulted in increased usage of mobile data; · On-going network investment in 5G and Internet of Things (“IoT”) networks is driving increased demand...","Evolving Systems provides real-time digital engagement solutions and services to approximately 100 customers in over 60 countries worldwide. Our portfolio features market-leading solutions and services for real-time analytics, customer acquisition and activation, customer value management and loyalty for the telecom industry promoting partnerships into retail and financial services. ﻿ We have transitioned from traditional software technology licensing, focused on cost savings, to selling business solutions focused on revenue growth and efficiency gains for the carrier. Our business model provides business solutions through customized software and managed services, thus creating recurring revenue relationships and providing opportunity to continually engage with our clients. ﻿ We offer real-time, interactive digital engagement solutions and services that drive increases in customer lifetime value for our enterprise clients.﻿ ","Evolving Systems provides real-time digital engagement solutions and services to approximately 100 customers in over 60 countries worldwide. Their portfolio features market-leading solutions and services for real-time analytics, customer acquisition and activation, customer value management, and loyalty for the telecom industry promoting partnerships into retail and financial services. The combination of these offerings increases customer activations and activity, extends their lifecycle, and increases customer spend resulting in increased customer lifetime value. The market for digital engagement to increase customer lifetime value is growing, and several key factors are driving carrier demand for next-generation solutions, supporting growth for specific products within the sector.",0.49350648852757634,0.9737123563433238
"ITEM 1. BUSINESS Our Business We develop, market, license, host, and support enterprise software applications that help organizations transform how they engage with their customers and process work. We also license our low code Pega Platform™ for rapid application development to clients that wish to build and extend their business applications. Our cloud-architected portfolio of customer engagement and digital process automation applications leverages artificial intelligence (“AI”), case management, and robotic automation technology, built on our unified low code Pega Platform, empowering businesses to quickly design, extend, and scale their enterprise applications to meet strategic business needs. To grow our business, we intend to: •increase market share by developing and delivering market-leading applications for marketing, sales, service, and operations that can work together seamlessly with maximum competitive differentiation; •execute new-market growth initiatives, further expanding go-to-market coverage within the Global 3000; and •continue to scale our marketing efforts to support the way today’s clients discover, evaluate, and buy products and services. Whether we are successful depends, in part, on our ability to: •execute our marketing and sales strategies; •appropriately manage our expenses as we grow our organization; •effectively develop new products and enhance our existing products; and •incorporate acquired technologies into our applications and unified Pega Platform. Cloud Transition We are in the process of transitioning our business to sell software primarily through subscription arrangements, particularly Pega Cloud (“Cloud Transition”). Until we substantially complete our Cloud Transition, which we anticipate will occur in early 2023, we expect to continue to experience lower revenue growth and lower operating cash flow growth or negative cash flow. The actual mix of revenue and new arrangements in a given period can fluctuate based on client preferences. See risk factor ""If we fail to manage our transition to a more subscription-based business model successfully, our results of operations and/or cash flows could be negatively impacted."" in","We develop, market, license, host, and support enterprise software applications that help organizations transform how they engage with their customers and process work. We also license our low code Pega Platform™ for rapid application development to clients that wish to build and extend their business applications. Our cloud-architected portfolio of customer engagement and digital process automation applications leverages artificial intelligence (“AI”), case management, and robotic automation technology, built on our unified low code Pega Platform, empowering businesses to quickly design, extend, and scale their enterprise applications to meet strategic business needs. We are in the process of transitioning our business to sell software primarily through subscription arrangements, particularly Pega Cloud (“Cloud Transition”). ","Pega is a software company that develops and supports enterprise software applications for customer engagement and digital process automation. They also offer a low code Pega Platform for rapid application development. Pega is transitioning to selling software primarily through subscription arrangements, which may result in lower revenue growth and negative cash flow until the transition is complete in early 2023. To grow their business, Pega plans to increase market share, expand go-to-market coverage, and scale their marketing efforts. Success will depend on executing marketing and sales strategies, managing expenses, developing new products, and incorporating acquired technologies.",0.3374999950031251,0.9068741011197408
"ITEM 1. Business Overview Model N is a leading provider of cloud revenue management solutions for life sciences and high tech companies. Our software helps companies drive mission critical business processes such as pricing, quoting, contracting, regulatory compliance, rebates and incentives. With deep industry expertise, Model N supports the complex business needs of the world’s leading brands in life sciences and high tech including Johnson & Johnson, AstraZeneca, Stryker, Seagate Technology, Broadcom, and Microchip Technology. Historically, companies tended to rely on a disjointed patchwork of manual processes, spreadsheets, point applications, and legacy systems to manage their revenue processes. These processes and systems operated in isolation from one another and were labor intensive, error prone, inflexible, and costly, often resulting in missed revenue opportunities, suboptimal margins, incentive overpayments, and increased revenue compliance risk. Current industry trends, which include shortening product lifecycles, tightening compliance and regulatory controls, increasing channel complexity and growing volumes of transactional data, are causing these outdated processes and legacy systems to become increasingly ineffective. Our expertise in cloud-based revenue management solutions, combined with our knowledge of the life sciences and high tech industries, has enabled us to develop software designed to meet the unique, strategic needs of these industries, such as managed care and government pricing for life sciences companies and channel incentives management for high tech companies. Model N Revenue Cloud transforms the revenue lifecycle into a strategic, end-to-end process aligned across the enterprise. Our industry specific solution suites - Revenue Cloud for Life Sciences and Revenue Cloud for High Tech - offer a range of solutions from individual products to complete product suites. Overview of the Life Sciences and High Tech Industries The life sciences and high tech industries are large and highly fragmented. Companies in both industries market their products to a global customer base through diverse channels. Additionally, high costs are required to launch a drug or medical device to the global market. Regulatory pressures, consolidation, and other factors in both industries continue to drive a considerable focus on revenue management. Management of the revenue lifecycle is a strategic imperative and a source of competitive advantage for life sciences and high tech companies as they address increasingly globalized markets, sophisticated buyers, complex channels, and expanding volumes of data from internal and market sources. Emerging business models like outcome based pricing and service bundles further complicate the revenue management processes, which increases the need for practical solutions. Several trends specific to these industries further complicate revenue management. Life Sciences: •the emergence of large group purchasing, managed care organizations and integrated healthcare delivery networks drive increased pricing pressure, contract volume, and complexity; •increased customer and channel incentives and rebates result in the increased risk of extending unearned discounts and the overpayment of rebates; •the shift of purchasing influence from physicians to economic buyers makes price and commercial terms key decision making factors; •increased spending on healthcare by governments instead of commercial entities adds further regulatory oversight to transactions; •expanded scope of government mandates, frequency of regulatory reporting and audits, and fines, all of which increase administrative burden and monitoring costs; •increased payer-provider consolidation which makes market access harder; and •increased revenue leakage through 340B channels. High Tech: •shortened product lifecycles driving rapid pricing changes and require quick responses to quotes and competitive bidding; •increased number of core high tech products sold into different end markets with segment-specific pricing; •cyclicality and rising R&D costs contributing to a focus on maximizing sell time, margins and revenues; •increased complexity of multi-tiered global distribution channels intensifying channel conflict and price erosion; •changing financial reporting requirements due to channel complexity; and •increased use of off-invoice discounting to offset upfront discounts and mask end-customer pricing resulting in a lack of price transparency that can erode gross margins. Challenges to Effective Revenue Management Traditionally, companies addressed revenue management through a patchwork of manual processes and inflexible and costly custom solutions. This outdated approach to revenue management impedes the ability of companies to respond to changing market conditions, preventing them from maximizing revenue and increasing their revenue compliance risk. Critical challenges include: •Incomplete and unreliable information for critical strategic decisions. Legacy manual processes and systems used to manage the revenue lifecycle create silos of data causing companies to make strategic marketing, pricing and resource allocation decisions that are based on incomplete or inaccurate information. As a result, revenue strategies can be suboptimal, budgets may be misallocated, and sales and marketing efforts can fail to positively impact revenues. •Revenue leakage due to inadequate contract management and enforcement. Customer-specific contracts with complex pricing and commercial terms are common in many industries, in particular life sciences and high tech. When the commercial terms of these contracts are not automated and monitored systematically, deviations from contract pricing can occur, volume commitments can be missed, unearned discounts may be given, and revenue can be lost. •Revenue leakage due to the overpayment of incentives. life sciences and high tech companies process massive volumes of rebates and incentives. A lack of centralized, automated and enforceable processes can result in overpayment of incentives. Revenue leakage is also driven by inconsistent global pricing, poor price concession controls, and unmet contractual volume commitments. •Ineffective pricing across geographies and complex channels. Sophisticated buyers deploy global procurement strategies to discover and exploit regional and channel differences in pricing and contracting. The inability to enforce a single price for a specific sales opportunity across regions and channels can result in channel conflicts, which leads to price and revenue erosion. •Inaccurate financial reporting. Complex contracts and distribution channels have made it more difficult to obtain and process financial information, which can result in inaccurate financial reporting. For example, high tech companies face significant complexity in financial reporting and revenue recognition at the point of sale in their distribution channels. Life sciences companies have substantial challenges correctly accruing their massive rebate and incentive claim volumes. •Difficulty complying with complicated government regulations. Satisfying the regulatory requirements of numerous federal and state programs is increasingly complex for life sciences companies. For...","Model N is a leading provider of cloud revenue management solutions for life sciences and high tech companies. Our software helps companies drive mission critical business processes such as pricing, quoting, contracting, regulatory compliance, rebates and incentives. With deep industry expertise, Model N supports the complex business needs of the world’s leading brands in life sciences and high tech including Johnson & Johnson, AstraZeneca, Stryker, Seagate Technology, Broadcom, and Microchip Technology. Historically, companies tended to rely on a disjointed patchwork of manual processes, spreadsheets, point applications, and legacy systems to manage their revenue processes. These processes and systems operated in isolation from one another and were labor intensive, error prone, inflexible, and costly, often resulting in missed revenue opportunities, suboptimal margins, incentive overpayments, and increased revenue compliance risk. Current industry trends, which include shortening product lifecycles, tightening compliance and regulatory controls, increasing channel complexity and growing volumes of transactional data, are causing these outdated processes and legacy systems to become increasingly ineffective. Our expertise in cloud-based revenue management solutions, combined with our knowledge of the life sciences and high tech industries, has enabled us to develop software designed to meet the unique, strategic needs of these industries, such as managed care and government pricing for life sciences companies and channel incentives management for high tech companies. Model N Revenue Cloud transforms the revenue lifecycle into a strategic, end-to-end process aligned across the enterprise. Our industry specific solution suites - Revenue Cloud for Life Sciences and Revenue Cloud for High Tech - offer a range of solutions from individual products to complete product suites. ","Model N provides cloud revenue management solutions for life sciences and high tech companies, helping them manage pricing, quoting, contracting, regulatory compliance, rebates, and incentives. The company's software is designed to meet the unique, strategic needs of these industries, such as managed care and government pricing for life sciences companies and channel incentives management for high tech companies. The life sciences and high tech industries are large and highly fragmented, with global customer bases and diverse channels. Revenue management is a strategic imperative and a source of competitive advantage for these companies as they address increasingly globalized markets, sophisticated buyers, complex channels, and expanding volumes of data from internal and market sources.",0.36065573332605483,0.9557106212730089
